{
  "feature_schema": "lwe-log2-v1",
  "format": "lattice-security/slow-attack-model",
  "generated_at": "2026-08-19T07:01:07.257893Z",
  "groups": [
    {
      "attack": "bkw",
      "cost_model": "BDGL16",
      "domain": {
        "log2_dimension": {
          "max": "7",
          "min": "6"
        },
        "log2_error_standard_deviation": {
          "max": "2",
          "min": "1.321928095"
        },
        "log2_modulus": {
          "max": "9",
          "min": "5"
        }
      },
      "holdout": {
        "max_overestimate_bits": "2.398857422",
        "mean_absolute_error_bits": "1.643378715",
        "p95_absolute_error_bits": "4.063551538",
        "samples": 6
      },
      "id": "1db81a4830f70665",
      "max_normalized_distance": "0.275",
      "neighbor_count": 4,
      "points": [
        {
          "log2_dimension": "7",
          "log2_error_standard_deviation": "2",
          "log2_modulus": "7",
          "security_bits": "59.977866489"
        },
        {
          "log2_dimension": "7",
          "log2_error_standard_deviation": "1.847996907",
          "log2_modulus": "8",
          "security_bits": "58.962915514"
        },
        {
          "log2_dimension": "6.321928095",
          "log2_error_standard_deviation": "1.321928095",
          "log2_modulus": "7",
          "security_bits": "45.4170653"
        },
        {
          "log2_dimension": "6",
          "log2_error_standard_deviation": "1.485426827",
          "log2_modulus": "9",
          "security_bits": "37.925582265"
        },
        {
          "log2_dimension": "6.584962501",
          "log2_error_standard_deviation": "2",
          "log2_modulus": "6",
          "security_bits": "51.883432472"
        },
        {
          "log2_dimension": "6.584962501",
          "log2_error_standard_deviation": "1.321928095",
          "log2_modulus": "8",
          "security_bits": "46.639035229"
        },
        {
          "log2_dimension": "7",
          "log2_error_standard_deviation": "1.321928095",
          "log2_modulus": "7",
          "security_bits": "59.904413267"
        },
        {
          "log2_dimension": "6",
          "log2_error_standard_deviation": "1.847996907",
          "log2_modulus": "8",
          "security_bits": "35.167520024"
        },
        {
          "log2_dimension": "7",
          "log2_error_standard_deviation": "2",
          "log2_modulus": "5",
          "security_bits": "69.776536587"
        },
        {
          "log2_dimension": "6",
          "log2_error_standard_deviation": "2",
          "log2_modulus": "7",
          "security_bits": "37.557323217"
        },
        {
          "log2_dimension": "6.321928095",
          "log2_error_standard_deviation": "1.321928095",
          "log2_modulus": "9",
          "security_bits": "38.528378865"
        },
        {
          "log2_dimension": "6.321928095",
          "log2_error_standard_deviation": "1.321928095",
          "log2_modulus": "8",
          "security_bits": "42.129569435"
        },
        {
          "log2_dimension": "6.321928095",
          "log2_error_standard_deviation": "2",
          "log2_modulus": "8",
          "security_bits": "42.234230207"
        },
        {
          "log2_dimension": "6.584962501",
          "log2_error_standard_deviation": "1.485426827",
          "log2_modulus": "9",
          "security_bits": "46.527052729"
        },
        {
          "log2_dimension": "6",
          "log2_error_standard_deviation": "1.847996907",
          "log2_modulus": "5",
          "security_bits": "43.204219228"
        },
        {
          "log2_dimension": "6.321928095",
          "log2_error_standard_deviation": "1.847996907",
          "log2_modulus": "5",
          "security_bits": "49.786232485"
        },
        {
          "log2_dimension": "6",
          "log2_error_standard_deviation": "1.678071905",
          "log2_modulus": "8",
          "security_bits": "34.796005779"
        },
        {
          "log2_dimension": "6.321928095",
          "log2_error_standard_deviation": "1.847996907",
          "log2_modulus": "9",
          "security_bits": "39.088985243"
        },
        {
          "log2_dimension": "7",
          "log2_error_standard_deviation": "1.847996907",
          "log2_modulus": "5",
          "security_bits": "69.695989577"
        },
        {
          "log2_dimension": "7",
          "log2_error_standard_deviation": "1.847996907",
          "log2_modulus": "6",
          "security_bits": "64.179458451"
        },
        {
          "log2_dimension": "6",
          "log2_error_standard_deviation": "1.321928095",
          "log2_modulus": "5",
          "security_bits": "40.042810686"
        },
        {
          "log2_dimension": "7",
          "log2_error_standard_deviation": "1.321928095",
          "log2_modulus": "5",
          "security_bits": "65.44037607"
        },
        {
          "log2_dimension": "6.321928095",
          "log2_error_standard_deviation": "1.485426827",
          "log2_modulus": "6",
          "security_bits": "45.882424241"
        },
        {
          "log2_dimension": "6.584962501",
          "log2_error_standard_deviation": "1.321928095",
          "log2_modulus": "9",
          "security_bits": "46.525781189"
        },
        {
          "log2_dimension": "6.321928095",
          "log2_error_standard_deviation": "1.321928095",
          "log2_modulus": "5",
          "security_bits": "47.319145965"
        },
        {
          "log2_dimension": "6.584962501",
          "log2_error_standard_deviation": "2",
          "log2_modulus": "9",
          "security_bits": "46.534207525"
        },
        {
          "log2_dimension": "6.584962501",
          "log2_error_standard_deviation": "2",
          "log2_modulus": "5",
          "security_bits": "58.487893956"
        },
        {
          "log2_dimension": "7",
          "log2_error_standard_deviation": "1.485426827",
          "log2_modulus": "9",
          "security_bits": "56.998949085"
        },
        {
          "log2_dimension": "6.584962501",
          "log2_error_standard_deviation": "1.678071905",
          "log2_modulus": "9",
          "security_bits": "46.529045128"
        },
        {
          "log2_dimension": "6.321928095",
          "log2_error_standard_deviation": "1.847996907",
          "log2_modulus": "7",
          "security_bits": "45.783493132"
        },
        {
          "log2_dimension": "6",
          "log2_error_standard_deviation": "1.847996907",
          "log2_modulus": "9",
          "security_bits": "37.925689505"
        },
        {
          "log2_dimension": "6.321928095",
          "log2_error_standard_deviation": "1.485426827",
          "log2_modulus": "7",
          "security_bits": "45.661118381"
        },
        {
          "log2_dimension": "7",
          "log2_error_standard_deviation": "1.847996907",
          "log2_modulus": "7",
          "security_bits": "59.931282485"
        },
        {
          "log2_dimension": "6.321928095",
          "log2_error_standard_deviation": "1.321928095",
          "log2_modulus": "6",
          "security_bits": "45.881605473"
        },
        {
          "log2_dimension": "6.321928095",
          "log2_error_standard_deviation": "1.678071905",
          "log2_modulus": "9",
          "security_bits": "38.767575624"
        },
        {
          "log2_dimension": "7",
          "log2_error_standard_deviation": "1.321928095",
          "log2_modulus": "6",
          "security_bits": "60.790308583"
        },
        {
          "log2_dimension": "7",
          "log2_error_standard_deviation": "1.847996907",
          "log2_modulus": "9",
          "security_bits": "56.998972703"
        },
        {
          "log2_dimension": "6",
          "log2_error_standard_deviation": "1.847996907",
          "log2_modulus": "6",
          "security_bits": "39.209577483"
        },
        {
          "log2_dimension": "6.321928095",
          "log2_error_standard_deviation": "2",
          "log2_modulus": "6",
          "security_bits": "46.069447056"
        },
        {
          "log2_dimension": "6.584962501",
          "log2_error_standard_deviation": "1.321928095",
          "log2_modulus": "5",
          "security_bits": "54.340954671"
        },
        {
          "log2_dimension": "7",
          "log2_error_standard_deviation": "2",
          "log2_modulus": "8",
          "security_bits": "58.976789639"
        },
        {
          "log2_dimension": "6.584962501",
          "log2_error_standard_deviation": "1.321928095",
          "log2_modulus": "6",
          "security_bits": "52.367012323"
        },
        {
          "log2_dimension": "6",
          "log2_error_standard_deviation": "1.321928095",
          "log2_modulus": "6",
          "security_bits": "39.682122474"
        },
        {
          "log2_dimension": "6.321928095",
          "log2_error_standard_deviation": "1.847996907",
          "log2_modulus": "6",
          "security_bits": "45.911633667"
        },
        {
          "log2_dimension": "6.584962501",
          "log2_error_standard_deviation": "1.847996907",
          "log2_modulus": "6",
          "security_bits": "51.801684359"
        },
        {
          "log2_dimension": "7",
          "log2_error_standard_deviation": "2",
          "log2_modulus": "9",
          "security_bits": "56.999018931"
        },
        {
          "log2_dimension": "6",
          "log2_error_standard_deviation": "1.678071905",
          "log2_modulus": "5",
          "security_bits": "42.986853753"
        },
        {
          "log2_dimension": "6.321928095",
          "log2_error_standard_deviation": "2",
          "log2_modulus": "5",
          "security_bits": "50.008858182"
        },
        {
          "log2_dimension": "6.321928095",
          "log2_error_standard_deviation": "1.678071905",
          "log2_modulus": "7",